{
  "manifest_version": "1.0",
  "tool_id": "z-image-turbo",
  "tool_version": "0.5.2",
  "created_at": "2026-02-05T23:25:03.051183+00:00",
  "files": [
    {
      "path": "src/main.py",
      "sha256": "787a28e4c56ad5fe96a64662cd3f48c21326b70474da9694831c9e117ee19b24",
      "size": 24356,
      "url": "https://hq.bitstation.local/api/v1/tools/z-image-turbo/0.5.2/files/src/main.py"
    },
    {
      "path": "requirements.txt",
      "sha256": "8909d71e7c425fe8ef762eb7569b181cdd73413e46f51f781f6d3ec9aa0f8d40",
      "size": 324,
      "url": "https://hq.bitstation.local/api/v1/tools/z-image-turbo/0.5.2/files/requirements.txt"
    },
    {
      "path": "models/z_image_turbo-Q4_K_M.gguf",
      "sha256": "745ec270db042409fde084d6b5cfccabf214a7fe5a494edf994a391125656afd",
      "size": 4981532736,
      "url": "https://hq.bitstation.local/api/v1/tools/z-image-turbo/0.5.2/files/models/z_image_turbo-Q4_K_M.gguf"
    }
  ],
  "delete_policy": "safe",
  "ignore_globs": [
    "venv/**",
    "cache/**",
    "user_data/**",
    "logs/**"
  ],
  "manifest_hash": "c9b10a4d4e8646c919ab6e5f7b8c9d0e1f2a3b4c5d6e7f8a9b0c1d2e3f4a5b6c"
}
